本名,外文名,别名,字号,所处时代,国籍,毕业院校,民族,出生时间,逝世时间,职业,官职,出生地,代表作品,人物关系,简介
司马相如,,司马长卿,,,中国,,汉族,约公元前179年,约公元前118年,文学家，诗人，辞赋家，文学创作,武骑常侍，中郎将建节使,蜀郡成都,《子虚赋》，《上林赋》，《大人赋》，《长门赋》，《美人赋》,妻子：卓文君,司马相如，字长卿，汉族，蜀郡成都人，祖籍左冯翊夏阳侨居蓬州西汉辞赋家，中国文化史文学史上杰出的代表。有明显的道家思想与神仙色彩。景帝时为武骑常侍，因病免。工辞赋，其代表作品为《子虚赋》。作品词藻富丽，结构宏大，使他成为汉赋的代表作家，后人称之为赋圣和“辞宗”。他与卓文君的爱情故事也广为流传。鲁迅的《汉文学史纲要》中还把二人放在一个专节里加以评述，指出：“武帝时文人，赋莫若司马相如，文莫若司马迁。”
卓文君,,卓文后,,西汉,,,汉族,公元前175年,公元前121年,,,蜀郡临邛,《白头吟》，《怨郎诗》，《诀别书》,"丈夫：司马相如
父亲：卓王孙",卓文君，原名文后，西汉时期蜀郡临邛人，汉代才女。中国古代四大才女之一、蜀中四大才女之一。卓文君为蜀郡临邛的冶铁巨商卓王孙之女，姿色娇美，精通音律，善弹琴，有文名。卓文君与汉代著名文人司马相如的一段爱情佳话至今被人津津乐道。她也有不少佳作，如《白头吟》，诗中“愿得一心人，白头不相离”堪称经典佳句。
扬雄,,,字子云,西汉,,,汉族,公元前53年,公元18年,,,蜀郡成都,《太玄》，《法言》，《方言》，《训纂篇》,,扬雄，字子云，汉族。西汉官吏、学者。西汉蜀郡成都人。扬雄少年好学，口吃，博览群书，长于辞赋。年四十余，始游京师长安，以文见召，奏《甘泉》、《河东》等赋。成帝时任给事黄门郎。王莽时任大夫，校书天禄阁。扬雄是继司马相如之后西汉最著名的辞赋家。所谓“歇马独来寻故事，文章两汉愧扬雄”。在刘禹锡著名的《陋室铭》中“西蜀子云亭”的西蜀子云即为扬雄。扬雄曾撰《太玄》等，将源于老子之道的玄作为最高范畴，并在构筑宇宙生成图式、探索事物发展规律时，以玄为中心思想，是汉朝道家思想的继承和发展者， 对后世意义可谓重大。
班固,,班孟坚,字孟坚,东汉,,,汉族,建武八年,永元四年,,,扶风安陵,《汉书》，《白虎通义》，《两都赋》,妹妹：班昭,班固，字孟坚，扶风安陵人，东汉著名史学家、文学家。班固出身儒学世家，其父班彪、伯父班嗣，皆为当时著名学者。在父祖的熏陶下，班固九岁即能属文，诵诗赋，十六岁入太学，博览群书，于儒家经典及历史无不精通。建武三十年，班彪过世，班固从京城洛阳迁回老家居住，开始在班彪《史记后传》的基础上，与其弟班超一同撰写《汉书》，后班超投笔从戎，班固继续撰写，前后历时二十余年，于建初中基本修成。汉和帝永元元年，大将军窦宪率军北伐匈奴，班固随军出征，任中护军，行中郎将，参议军机大事，大败北单于后撰下著名的《封燕然山铭》。后窦宪因擅权被杀，班固受株连，死于狱中，时年六十一岁。班固一生著述颇丰。作为史学家，《汉书》是继《史记》之后中国古代又一部重要史书，“前四史”之一；作为辞赋家，班固是“汉赋四大家”之一，《两都赋》开创了京都赋的范例，列入《文选》第一篇；同时，班固还是经学理论家，他编辑撰成的《白虎通义》，集当时经学之大成，使谶纬神学理论化、法典化。
张衡,,张平子,,,中国,,汉族,78年,139年,从政，科学研究，著书立说,太史令，河间相，尚书,南阳西鄂,《灵宪》，《归田赋》，《二京赋》，《张河间集》,爷爷：张堪,张衡，字平子。汉族，南阳西鄂人，南阳五圣之一，与司马相如、扬雄、班固并称汉赋四大家。中国东汉时期伟大的天文学家、数学家、发明家、地理学家、文学家，在东汉历任郎中、太史令、侍中、河间相等职。晚年因病入朝任尚书，于永和四年逝世，享年六十二岁。北宋时被追封为西鄂伯。张衡在天文学方面著有《灵宪》、《浑仪图注》等，数学著作有《算罔论》，文学作品以《二京赋》、《归田赋》等为代表。《隋书·经籍志》有《张衡集》14卷，久佚。明人张溥编有《张河间集》，收入《汉魏六朝百三家集》。张衡为中国天文学、机械技术、地震学的发展作出了杰出的贡献，发明了浑天仪、地动仪，是东汉中期浑天说的代表人物之一。被后人誉为“木圣”，由于他的贡献突出，联合国天文组织将月球背面的一个环形山命名为“张衡环形山”，太阳系中的1802号小行星命名为“张衡星”。后人为纪念张衡，在南阳修建了张衡博物馆。
曹操,,一名吉利,字孟德，小字阿瞒,东汉,,,汉族,155年,220年3月15日,,丞相,沛国谯县,《观沧海》，《龟虽寿》，《让县自明本志令》，《蒿里行》，《孟德新书》,"妻子：武宣卞皇后
女儿：金乡公主，曹华，曹宪
儿子：曹植，曹铄，曹整，曹勤
女婿：刘协",曹操，字孟德，一名吉利，小字阿瞒，沛国谯县人。东汉末年杰出的政治家、军事家、文学家、书法家，三国中曹魏政权的奠基人。曹操曾担任东汉丞相，后加封魏王，奠定了曹魏立国的基础。去世后谥号为武王。其子曹丕称帝后，追尊为武皇帝，庙号太祖。东汉末年，天下大乱，曹操以汉天子的名义征讨四方，对内消灭二袁、吕布、刘表、马超、韩遂等割据势力，对外降服南匈奴、乌桓、鲜卑等，统一了中国北方，并实行一系列政策恢复经济生产和社会秩序，扩大屯田、兴修水利、奖励农桑、重视手工业、安置流亡人口、实行“租调制”，从而使中原社会渐趋稳定、经济出现转机。黄河流域在曹操统治下，政治渐见清明，经济逐步恢复，阶级压迫稍有减轻，社会风气有所好转。曹操在汉朝的名义下所采取的一些措施具有积极作用。曹操军事上精通兵法，重贤爱才，为此不惜一切代价将看中的潜能分子收于麾下；生活上善诗歌，抒发自己的政治抱负，并反映汉末人民的苦难生活，气魄雄伟，慷慨悲凉；散文亦清峻整洁，开启并繁荣了建安文学，给后人留下了宝贵的精神财富，鲁迅评价其为“改造文章的祖师”。同时曹操也擅长书法，唐朝张怀瓘在《书断》将曹操的章草评为“妙品”。
曹植,,陈思王，陈王,字子建,汉末三国,,,汉族,192年,232年12月27日,,,东武阳,《七步诗》，《白马篇》，《洛神赋》，《七哀诗》，《飞龙篇》,"父亲：曹操
哥哥：曹丕
弟弟：曹冲",曹植，字子建，沛国谯县人，生于东武阳，是曹操与武宣卞皇后所生第三子，生前曾为陈王，去世后谥号“思”，因此又称陈思王。曹植是三国时期著名文学家，作为建安文学的代表人物之一与集大成者，他在两晋南北朝时期，被推尊到文章典范的地位。其代表作有《洛神赋》《白马篇》《七哀诗》等。后人因其文学上的造诣而将他与曹操、曹丕合称为“三曹”。其诗以笔力雄健和词采华美见长，留有集三十卷，已佚，今存《曹子建集》为宋人所编。曹植的散文同样亦具有“情兼雅怨，体被文质”的特色，加上其品种的丰富多样，使他在这方面取得了卓越的成就。南朝宋文学家谢灵运有“天下才有一石，曹子建独占八斗”的评价。文学批评家钟嵘亦赞曹植“骨气奇高，词彩华茂，情兼雅怨，体被文质，粲溢今古，卓尔不群。”并在《诗品》中把他列为品第最高的诗人。王士祯尝论汉魏以来二千年间诗家堪称“仙才”者，曹植、李白、苏轼三人耳。
曹丕,,魏文帝,字子桓,汉末→三国,,,汉族,187年冬,226年6月29日,,,豫州沛国谯,《典论》，《燕歌行》，《寡妇诗》，《答临淄侯植诏》,"妻子：文昭甄皇后
儿子：曹叡
母亲：武宣卞皇后
弟弟：曹植，曹京，曹铄",魏文帝曹丕，字子桓，豫州沛国谯县人。三国时期著名的政治家、文学家，曹魏开国皇帝。魏武帝曹操次子，与正室卞夫人的嫡长子。曹丕自幼文武双全，博览经传，通晓诸子百家学说。建安二十二年，曹丕击败了其弟曹植，被立为魏王世子。建安二十五年，曹操逝世，曹丕继任丞相、魏王。同年，受禅登基，以魏代汉，结束了汉朝四百多年的统治，建立了魏国。曹丕在位期间，采纳吏部尚书陈群的意见，于黄初元年 命其制定九品中正制，成为魏晋南北朝时期主要的选官制度。而且平定了青州、徐州一带的割据势力，最终完成了北方的统一。对外平定边患，击退鲜卑，和匈奴、氐、羌等外夷修好，恢复在西域的建置。黄初七年，曹丕病逝于洛阳，时年四十岁。谥号文帝，庙号高祖，葬于首阳陵。曹丕于诗、赋、文学皆有成就，尤擅长于五言诗，与其父曹操和弟曹植，并称“建安三曹”，今存《魏文帝集》二卷。另外，曹丕著有《典论》，当中的《论文》是中国文学史上第一部有系统的文学批评专论作品。
蔡文姬,,蔡琰,字文姬，又字昭姬,汉末三国,,,汉族,,,,,陈留郡圉县,《悲愤诗》，《胡笳十八拍》,"丈夫：董祀
父亲：蔡邕",蔡琰，字文姬，又字昭姬。生卒年不详。东汉陈留郡圉县人，东汉大文学家蔡邕的女儿。初嫁于卫仲道，丈夫死去而回到自己家里，后值因匈奴入侵，蔡琰被匈奴左贤王掳走，嫁给匈奴人，并生育了两个孩子。十二年后，曹操统一北方，用重金将蔡琰赎回，并将其嫁给董祀。蔡琰同时擅长文学、音乐、书法。《隋书·经籍志》著录有《蔡文姬集》一卷，但已经失传。现在能看到的蔡文姬作品只有《悲愤诗》二首和《胡笳十八拍》。历史上记载蔡琰的事迹并不多，但“文姬归汉”的故事却在历朝历代被广为流传。
阮籍,,阮嗣宗，阮步兵,,,,,汉族,公元210年,公元263年,,,陈留尉氏,《大人先生传》，《咏怀八十二首》,"父亲：阮瑀
侄子：阮咸
好友：刘伶",阮籍，三国时期魏国诗人。字嗣宗。陈留尉氏人。竹林七贤之一。曾任步兵校尉，世称阮步兵。崇奉老庄之学，政治上则采取谨慎避祸的态度。阮籍是“正始之音”的代表，著有《咏怀八十二首》、《大人先生传》等，其著作收录在《阮籍集》中。
陶渊明,,陶潜,字元亮,东晋→南北朝,,,汉族,公元352或365年,公元427年,诗人，辞赋家,,浔阳柴桑,《陶渊明集》,,陶渊明，字元亮，又名潜，私谥“靖节”，世称靖节先生，浔阳柴桑人。东晋末至南朝宋初期伟大的诗人、辞赋家。曾任江州祭酒、建威参军、镇军参军、彭泽县令等职，最末一次出仕为彭泽县令，八十多天便弃职而去，从此归隐田园。他是中国第一位田园诗人，被称为“古今隐逸诗人之宗”，有《陶渊明集》。
谢灵运,,谢客，谢康公，谢康乐，谢公义,字灵运,南北朝,,,汉族,385年,433年,,,会稽始宁,《庐山慧远法师诔》，《归途赋》，《述祖德诗》,,谢灵运，原名公义，字灵运，以字行于世，小名客儿，世称谢客。出身陈郡谢氏，祖籍陈郡阳夏，生于会稽始宁。南北朝时期诗人、佛学家、旅行家。晋安帝元兴二年，谢灵运继承了祖父的爵位，被封为康乐公。义熙元年，出任大司马司马德文的行参军。此后任抚军将军记室参军、太尉参军等职。刘宋代晋后，降封康乐侯，历任永嘉太守、秘书监、临川内史，元嘉十年被宋文帝刘义隆以“叛逆”罪名杀害，年仅四十九岁。谢灵运少即好学，博览群书，工诗善文。其诗与颜延之齐名，并称“颜谢”，是第一位全力创作山水诗的诗人，他还兼通史学，擅书法，曾翻译外来佛经，并奉诏撰《晋书》。明人辑有《谢康乐集》。
李密,,玄邃，法主,永平,永平,中国,,汉族,582年,619年1月20日,诸侯,瓦岗寨西魏国首领，唐光禄卿,长安,《淮阳感怀》,,李密，字玄邃， 小字法主，辽东襄平。隋末唐初的群雄之一。出身辽东李氏，来自四世三公，文武双全，志向远大。隋末群雄起义时，成为瓦岗军首领之一，自称魏公，率领瓦岗军屡败隋军，威震天下。瓦岗军原领袖翟让准备让位，遭到哥哥从中阻拦。李密废杀瓦岗寨主翟让，引发内部不稳，屡为隋军所败，接受越王杨侗招抚，率军拼杀宇文化及，损失惨重。终为王世充击败，率部投降李唐，封邢国公。武德二年，图谋叛唐自立，为盛彦师斩于熊耳山。
王勃,,,字子安,唐代,,,汉人,约650年,约676年,,,绛州龙门,《滕王阁序》，《送杜少府之任蜀州》,,王勃，字子安，汉族，唐代文学家。古绛州龙门人，出身儒学世家，与杨炯、卢照邻、骆宾王并称为“王杨卢骆”、“初唐四杰”。王勃自幼聪敏好学，据《旧唐书》记载，他六岁即能写文章，文笔流畅，被赞为“神童”。九岁时，读颜师古注《汉书》，作《指瑕》十卷以纠正其错。十六岁时，应幽素科试及第，授职朝散郎。因做《斗鸡檄》被赶出沛王府。之后，王勃历时三年游览巴蜀山川景物，创作了大量诗文。返回长安后，求补得虢州参军。在参军任上，因私杀官奴二次被贬。唐高宗上元三年八月，自交趾探望父亲返回时，不幸渡海溺水，惊悸而死。王勃在诗歌体裁上擅长五律和五绝，代表作品有《送杜少府之任蜀州》等；主要文学成就是骈文，无论是数量还是质量，堪称一时之最，代表作品有《滕王阁序》等。
卢照邻,,卢升之，幽忧子,,,中国,,汉族,630年左右,说法多种：680-695,诗人,,幽州范阳,《长安古意》，《十五夜观灯》，《元日述怀》,,卢照邻字升之，自号幽忧子，汉族，幽州范阳人，初唐诗人。卢照邻出身望族，曾为王府典签，又出任益州新都尉，在文学上，他与王勃、杨炯、骆宾王以文词齐名，号为“初唐四杰”。有7卷本的《卢升之集》、明张燮辑注的《幽忧子集》存世。卢照邻尤工诗歌骈文，以歌行体为佳，不少佳句传颂不绝，如“得成比目何辞死，愿作鸳鸯不羡仙”等，更被后人誉为经典。
杨炯,,杨盈川,,初唐,,,汉族,650年,约693年,,,华州华阴,《从军行》，《战城南》,,杨炯，华州华阴人，唐代文学家，与王勃、卢照邻、骆宾王并称初唐四杰。杨炯自幼聪敏博学，唐显庆四年应童子举及弟，翌年待制弘文馆，唐高宗上元三年应制举，补秘书省校书郎，唐永淳元年擢为太子詹事司直，唐垂拱二年被贬为梓州司法参军，唐如意元年任盈川令，约如意二年卒于任上。杨炯文学才华出众，善写散文，尤擅诗。现存诗30余首，以五言见长，多边塞征战诗篇，所作如《从军行》《出塞》《战城南》《紫骝马》等 ，气势轩昂，风格豪放，表现了为国立功的战斗精神。在艺术上，对仗工整，音韵合律，既有律诗的严谨之风，又有乐府诗的明快特色。其他唱和、纪游的诗篇则无甚特色，且未尽脱绮艳之风。另存赋、序、表、碑、铭、志、状等50余篇。杨炯反对宫体诗风，主张“骨气”、“刚健”的文风。他的诗在内容和艺术风格上以突破齐梁“宫体”诗风为特色，在诗歌发展史上起到承前启后的作用。明代童佩辑有《杨盈川集》十卷。
骆宾王,,骆观光，骆临海,字观光,初唐,,,汉族,约公元619年,约公元687年,,,婺州义乌,《为徐敬业讨武曌檄》，《帝京篇》，《畴昔篇》，《咏鹅》,,骆宾王，字观光，汉族，婺州义乌人，唐代诗人。高宗永徽中，为道王李元庆府属，历武功、长安主簿。仪凤三年，入为侍御史，因事下狱，次年遇赦。调露二年，除临海丞，不得志，辞官。徐敬业起兵讨伐武则天时，骆宾王为其代作《为徐敬业讨武曌檄》。檄文罗列了武后的罪状，写得极感人。当武后读到“一抔之土未干，六尺之孤安在”两句时，极为震动，责问宰相为何不早重用此人。徐敬业兵败后，骆宾王下落不明，或说被乱军所杀，或说遁入了空门。骆宾王与王勃、杨炯、卢照邻合称“初唐四杰”。他辞采华胆，格律谨严。长篇如《帝京篇》，五七言参差转换，讽时与自伤兼而有之；小诗如《于易水送人》，二十字中，悲凉慷慨，余情不绝。有《骆宾王文集》遗世。
陈子昂,,陈伯玉，陈拾遗，“诗骨”,字伯玉,唐朝,,,汉族,公元659年,公元700年,,,梓州射洪,《感遇》，《登幽州台歌》，《登泽州城北楼宴》,父亲：陈元敬,陈子昂，字伯玉，梓州射洪人，唐代诗人，初唐诗文革新人物之一。因曾任右拾遗，后世称陈拾遗。青少年时轻财好施，慷慨任侠，24岁举进士，以上书论政得到女皇武则天重视，授麟台正字。后升右拾遗，直言敢谏，曾因“逆党”反对武后而株连下狱。在26岁、36岁时两次从军边塞，对边防颇有些远见。38岁（圣历元年698)时，因父老解官回乡，不久父死。陈子昂居丧期间，权臣武三思指使射洪县令段简罗织罪名，加以迫害，冤死狱中。其存诗共100多首，其诗风骨峥嵘，寓意深远，苍劲有力。其中最有代表性的有组诗《感遇》38首，《蓟丘览古》7首和《登幽州台歌》、《登泽州城北楼宴》等。陈子昂与司马承祯、卢藏用、宋之问、王适、毕构、李白、孟浩然、王维、贺知章称为仙宗十友。
宋之问,,,字延清,初唐,,,汉,约656年,约712年,唐代诗人,,汾州隰城,《度大庾岭》,,宋之问，字延清，名少连，汉族，虢州弘农人，初唐时期的诗人，与沈佺期并称“沈宋”。唐高宗上元二年，进士及第，当时掌握实权的是武则天，富有才学的宋之问深得赏识，被召入文学馆，不久出授洛州参军，永隆元年，与杨炯一起进入崇文馆任学士。与陈子昂、卢藏用、司马承祯、王适、毕构、李白、孟浩然、王维、贺知章称为仙宗十友。
杜审言,,,字必简,唐代,,,汉族,645年,708年,,,襄阳,《杜审言诗集》,,杜审言，字必简，祖籍襄州襄阳，河南巩县人，晋征南将军杜预的远裔，“诗圣”杜甫的祖父。唐高宗咸亨进士，唐中宗时，因与张易之兄弟交往，被流放峰州。曾任隰城尉、洛阳丞等小官，累官修文馆直学士，与李峤、崔融、苏味道被称为“文章四友”，是唐代“近体诗”的奠基人之一，作品多朴素自然。其五言律诗，格律谨严。原有集，已散佚，后人辑有《杜审言诗集》。
高适,,高常侍,达夫，仲武,唐朝,,,汉族,704年,765年,,刑部侍郎，散骑常侍,渤海蓨,《高常侍集》,,高适，字达夫，一字仲武，渤海蓨人，后迁居宋州宋城。安东都护高侃之孙，唐代大臣、诗人。曾任刑部侍郎、散骑常侍，封渤海县侯，世称高常侍。于永泰元年正月病逝，卒赠礼部尚书，谥号忠。作为著名边塞诗人，高适与岑参并称“高岑”，与岑参、王昌龄、王之涣合称“边塞四诗人”。其诗笔力雄健，气势奔放，洋溢着盛唐时期所特有的奋发进取、蓬勃向上的时代精神。有文集二十卷。
岑参,,岑嘉州,,唐朝,,,汉族,约开元三年,约大历五年,,,一说荆州江陵，一说南阳,《岑嘉州诗集》,,岑参，荆州江陵人，一说南阳人，后徙居江陵，唐代诗人，与高适并称“高岑”。岑参早岁孤贫，从兄就读，遍览史籍；天宝三载进士及第，初为率府兵曹参军，后两次从军边塞，先任安西节度使高仙芝幕府掌书记，后在天宝末年封常清任安西北庭节度使时任封常清幕府判官；唐代宗时，曾任嘉州刺史，故世称“岑嘉州”；后约大历五年卒于成都，享年约五十六岁。文学创作方面，岑参工诗，长于七言歌行，对边塞风光，军旅生活，以及异域的文化风俗有亲切的感受，故其边塞诗尤多佳作。
王维,,王右丞，诗佛,字摩诘，号摩诘居士,唐朝,,,汉族,701年，一说699年,761年,,尚书右丞,蒲州,《王摩诘文集》,弟弟：王缙,王维，字摩诘，号摩诘居士。河东蒲州人，祖籍山西祁县。唐朝著名诗人、画家。王维出身河东王氏，于开元十九年状元及第。历官右拾遗、监察御史、河西节度使判官。唐玄宗天宝年间，王维拜吏部郎中、给事中。安禄山攻陷长安时，王维被迫受伪职。长安收复后，被责授太子中允。唐肃宗乾元年间任尚书右丞，故世称“王右丞”。王维参禅悟理，学庄信道，精通诗、书、画、音乐等，以诗名盛于开元、天宝间，尤长五言，多咏山水田园，与孟浩然合称“王孟”，有“诗佛”之称。书画特臻其妙，后人推其为南宗山水画之祖。苏轼评价其：“味摩诘之诗，诗中有画；观摩诘之画，画中有诗。”存诗400余首，代表诗作有《相思》、《山居秋暝》等。著作有《王右丞集》、《画学秘诀》。
孟浩然,,诗星，孟襄阳，孟浩,字浩然，孟山人,唐代,,,汉族,公元689年,公元740年,,,湖北襄阳,《孟浩然集》，《过故人庄》，《春晓》，《宿建德江》,,孟浩然，名浩，字浩然，号孟山人，襄州襄阳人，唐代著名的山水田园派诗人，世称“孟襄阳”。因他未曾入仕，又称之为“孟山人”。孟浩然生当盛唐，早年有志用世，在仕途困顿、痛苦失望后，尚能自重，不媚俗世，修道归隐终身。曾隐居鹿门山。40岁时，游长安，应进士举不第。曾在太学赋诗，名动公卿，一座倾服，为之搁笔。开元二十五年张九龄招致幕府，后隐居。孟诗绝大部分为五言短篇，多写山水田园和隐居的逸兴以及羁旅行役的心情。其中虽不无愤世嫉俗之词，而更多属于诗人的自我表现。孟浩然的诗在艺术上有独特的造诣，后人把孟浩然与盛唐另一山水诗人王维并称为“王孟”，有《孟浩然集》三卷传世。
崔颢,,,,,中国唐朝,,汉族,704年,754年,诗人，河东节度使军幕，太仆寺丞，司勋员外郎,,汴州,《黄鹤楼》，《辽西作》，《崔颢集》,,崔颢，汴州人，唐代诗人。唐玄宗开元十一年进士，官至太仆寺丞，天宝中为司勋员外郎。最为人称道的是他那首《黄鹤楼》，据说李白为之搁笔，曾有“眼前有景道不得，崔颢题诗在上头”的赞叹。《全唐诗》收录诗四十二首。他秉性耿直，才思敏捷，其作品激昂豪放，气势宏伟，著有《崔颢集》。
贺知章,,贺秘监,字季真，号四明狂客,唐代,,,汉人,约公元659年,约公元744年,,,越州永兴,《咏柳》，《回乡偶书二首》,好友：张旭，李白，包融,贺知章，唐代诗人、书法家。字季真，晚年自号“四明狂客”“秘书外监”，越州永兴人。少时以诗文知名。武则天证圣元年中乙未科状元，授予国子四门博士，迁太常博士。后历任礼部侍郎、秘书监、太子宾客等职。贺知章为人旷达不羁，好酒，有“清谈风流”之誉，晚年尤纵。86岁告老还乡，不久去世。与张若虚、张旭、包融并称“吴中四士”；与李白、李适之等谓“饮中八仙”；又与陈子昂、卢藏用、宋之问、王适、毕构、李白、孟浩然、王维、司马承祯等称为“仙宗十友”。其诗文以绝句见长，除祭神乐章、应制诗外，其写景、抒怀之作风格独特，清新潇洒，其中《咏柳》《回乡偶书》等脍炙人口，千古传诵。作品大多散佚，《全唐诗》录其诗19首。
