本名,外文名,别名,字号,所处时代,国籍,毕业院校,民族,出生时间,逝世时间,职业,官职,出生地,代表作品,人物关系,简介
陆游,,,字务观，号放翁,南宋,,,汉族,公元1125年11月13日,公元1210年1月26日,,,越州山阴,《剑南诗稿》，《渭南文集》，《老学庵笔记》,前妻：唐婉,陆游，字务观，号放翁，汉族，越州山阴人，尚书右丞陆佃之孙，南宋文学家、史学家、爱国诗人。陆游生逢北宋灭亡之际，少年时即深受家庭爱国思想的熏陶。宋高宗时，参加礼部考试，因受秦桧排斥而仕途不畅。宋孝宗即位后，赐进士出身，历任福州宁德县主簿、敕令所删定官、隆兴府通判等职，因坚持抗金，屡遭主和派排斥。乾道七年，应四川宣抚使王炎之邀，投身军旅，任职于南郑幕府。次年，幕府解散，陆游奉诏入蜀，与范成大相知。宋光宗继位后，升为礼部郎中兼实录院检讨官，不久即因“嘲咏风月”罢官归居故里。嘉泰二年，宋宁宗诏陆游入京，主持编修孝宗、光宗《两朝实录》和《三朝史》，官至宝章阁待制。书成后，陆游长期蛰居山阴，嘉定二年与世长辞，留绝笔《示儿》。陆游一生笔耕不辍，诗词文俱有很高成就。其诗语言平易晓畅、章法整饬谨严，兼具李白的雄奇奔放与杜甫的沉郁悲凉，尤以饱含爱国热情对后世影响深远。词与散文成就亦高，刘克庄《后村诗话续集》谓其词“激昂慷慨者，稼轩不能过”。有手定《剑南诗稿》85卷，收诗9000余首。又有《渭南文集》50卷、《老学庵笔记》10卷及《南唐书》等。书法遒劲奔放，存世墨迹有《苦寒帖》等。
王安石,,王荆公，王文公，临川先生,字介甫，号半山,北宋,,,汉族,1021年12月18日,1086年5月21日,,左仆射，观文殿大学士，司空,临川,《王临川集》，《临川集拾遗》，《临川先生文集》,"儿子：王雱
父亲：王益
弟弟：王安礼
学生：王无咎
对手：徐禧",王安石，字介甫，号半山，汉族，临川人，北宋著名思想家、政治家、文学家、改革家。庆历二年，王安石进士及第。历任扬州签判、鄞县知县、舒州通判等职，政绩显著。熙宁二年，任参知政事，次年拜相，主持变法。因守旧派反对，熙宁七年罢相。一年后，宋神宗再次起用，旋又罢相，退居江宁。元祐元年，保守派得势，新法皆废，郁然病逝于钟山，追赠太傅。绍圣元年，获谥“文”，故世称王文公。王安石潜心研究经学，著书立说，被誉为“通儒”，创“荆公新学”，促进宋代疑经变古学风的形成。在哲学上，他用“五行说”阐述宇宙生成，丰富和发展了中国古代朴素唯物主义思想；其哲学命题“新故相除”，把中国古代辩证法推到一个新的高度。在文学上，王安石具有突出成就。其散文简洁峻切，短小精悍，论点鲜明，逻辑严密，有很强的说服力，充分发挥了古文的实际功用，名列“唐宋八大家”；其诗“学杜得其瘦硬”，擅长于说理与修辞，晚年诗风含蓄深沉、深婉不迫，以丰神远韵的风格在北宋诗坛自成一家，世称“王荆公体”；其词写物咏怀吊古，意境空阔苍茫，形象淡远纯朴，营造出一个士大夫文人特有的情致世界。有《王临川集》、《临川集拾遗》等存世。
元好问,,元才子，遗山先生,字裕之，号遗山,金朝→大蒙古国,,,汉族,1190年8月10日,1257年10月12日,,知制诰,太原秀容,《遗山集》，《中州集》，《续夷坚志》,,元好问，字裕之，号遗山，世称遗山先生。太原秀容人。金末至大蒙古国时期著名文学家、历史学家。元好问自幼聪慧，有“神童”之誉。金宣宗兴定五年，元好问进士及第。正大元年，又以宏词科登第后，授权国史院编修，官至知制诰。金朝灭亡后，元好问被囚数年。晚年重回故乡，隐居不仕，于家中潜心著述。元宪宗七年，元好问逝世，年六十八。元好问是宋金对峙时期北方文学的主要代表、文坛盟主，又是金元之际在文学上承前启后的桥梁，被尊为“北方文雄”、“一代文宗”。他擅作诗、文、词、曲。其中以诗作成就最高，其“丧乱诗”尤为有名；其词为金代一朝之冠，可与两宋名家媲美；其散曲虽传世不多，但当时影响很大，有倡导之功。有《元遗山先生全集》、《中州集》。
王冕,,王元章，煮石山农，梅花屋主,,,元末明初,,汉,1287年,1359年,画家，诗人，篆刻家,,浙江省绍兴市诸暨市枫桥镇,《墨梅》，《白梅》，《南枝春早图》，《墨梅图》，《三君子图》,,王冕，字元章，号煮石山农，亦号“食中翁”、“梅花屋主”等，浙江省绍兴市诸暨枫桥人，元朝著名画家、诗人、篆刻家。他出身贫寒，幼年替人放牛，靠自学成才。王冕性格孤傲，鄙视权贵，诗作多同情人民苦难、谴责豪门权贵、轻视功名利禄、描写田园隐逸生活之作。有《竹斋集》3卷，续集2卷。一生爱好梅花，种梅、咏梅，又攻画梅。所画梅花花密枝繁，生意盎然，劲健有力，对后世影响较大。存世画迹有《南枝春早图》《墨梅图》《三君子图》等。能治印，创用花乳石刻印章，篆法绝妙。《明史》有传。
高启,Gao，Qi,高季迪，青丘子,,,明朝,,汉族,1336年,1373年,诗人,,江苏苏州,《高太史大全集》，《凫藻集》，《扣舷集》,,高启，汉族，元末明初著名诗人，文学家。字季迪，号槎轩，长洲人。元末隐居吴淞青丘，自号青丘子。高启才华高逸，学问渊博，能文，尤精于诗，与刘基、宋濂并称“明初诗文三大家”，又与杨基、张羽、徐贲被誉为“吴中四杰”，当时论者把他们比作“初唐四杰”。又与王行等号“北郭十友”。明洪武初，以荐参修《元史》，授翰林院国史编修官，受命教授诸王。擢户部右侍郎，力辞不受。苏州知府魏观在张士诚宫址改修府治，获罪被诛。高启曾为之作《郡治上梁文》，有“龙蟠虎踞”四字，被疑为歌颂张士诚，连坐腰斩。著有《高太史大全集》、《凫藻集》等。
杨慎,,杨文宪,字用修，号升庵,明朝,,,汉族,1488年12月8日,1559年8月8日,,翰林院修撰,北京孝顺衚衕,《升庵集》，《江陵别内》，《宝井篇》，《滇池涸》,"父亲：杨廷和
好友：曾屿",杨慎，字用修，初号月溪、升庵，又号逸史氏、博南山人、洞天真逸、滇南戍史、金马碧鸡老兵等。四川新都人，祖籍庐陵。明朝著名文学家，明代三才子之首，东阁大学士杨廷和之子。杨慎于正德六年状元及第，官翰林院修撰，参与编修《武宗实录》。武宗微行出居庸关，他上疏抗谏。世宗继位，复为翰林修撰，任经筵讲官。嘉靖三年，因“大礼议”受廷杖，谪戍于云南永昌卫。曾率家奴助平寻甸安铨、武定凤朝文叛乱，此后虽往返于四川、云南等地，仍终老于永昌卫。嘉靖三十八年，杨慎卒于戍所，年七十二。明穆宗时追赠光禄寺少卿，明熹宗时追谥“文宪”，世称“杨文宪”。杨慎在滇南三十年，博览群书。后人论及明代记诵之博、著述之富，推杨慎为第一。他又能文、词及散曲，论古考证之作范围颇广。其诗沉酣六朝，揽采晚唐，创为渊博靡丽之词，造诣深厚，独立于当时风气之外。著作达四百余种，后人辑为《升庵集》。
厉鹗,,,字：太鸿，号：樊榭，又字：雄飞,清代,,,,1692年,1752年,,,,《樊榭山房集》，《宋诗纪事》，《辽史拾遗》，《东城杂记》,,厉鹗，字太鸿，又字雄飞，号樊榭、南湖花隐等，钱塘人，清代著名诗人、学者，浙西词派中坚人物。康熙五十九年，李绂在浙江主持乡试时，看到厉鹗的试卷，大为欣赏。厉鹗于该年考中举人。进京以后，以诗为汤右曾所赏识，但未能考中进士。乾隆元年，为浙江巡抚程元章推荐，参加“博学鸿词”考试。由于考试过程中，误将《论》置于《诗》前，以不合程式再次名落孙山。此后，终身未仕。厉鹗在词方面具有极高的造诣，为浙西词派中期的代表。在词派问题上，他推崇姜夔、张炎等人为首的宋词南宗，贬低辛弃疾等人的北宗。厉鹗以“清”与“雅”作为词好坏的标准。他主张在艺术特点上，词应该是幽隽清绮，婉约淡冷；作品蕴意上，词要适度表达作者纯正的情感，寄以不含俗态的清高志性。他与查为仁合编的《绝妙好词笺》成为继朱彝尊《词综》之后推崇南宋词方面最有影响的著作。另外，厉鹗也长于写诗，特别是五言诗。他与杭世骏齐名，《清代学者象传》中称其：“为诗精深峭洁，截断众流，于新城、秀水外自树一帜。”厉鹗读书搜奇嗜博，钩深摘异，尤熟于宋元以后的掌故。著有《樊榭山房集》、《宋诗纪事》、《辽史拾遗》、《东城杂记》、《南宋杂事诗》等书。其中《南宋杂事诗》一书，采诸书为之注，征引浩博，为考史事者所重。
朱彝尊,,,字锡鬯，号竹垞，驱芳，金风亭长,清代,,,汉族,1629年10月7日,1709年11月14日,词人，学者,,浙江秀水,《曝书亭集》，《日下旧闻》，《经义考》，《明诗综》，《词综》,,朱彝尊，字锡鬯，号竹垞，又号醧舫，晚号小长芦钓鱼师，别号金风亭长，浙江秀水人。清朝词人、学者、藏书家，明代大学士朱国祚曾孙。康熙十八年举博学鸿词科，除翰林院检讨。二十二年，入直南书房。博通经史，参加纂修《明史》。作词风格清丽，为“浙西词派”的创始人，与陈维崧并称“朱陈”，与王士祯称南北两大诗宗；精于金石，购藏古籍图书不遗余力，为清初著名藏书家之一。著有《曝书亭集》80卷，《日下旧闻》42卷，《经义考》300卷；选《明诗综》100卷，《词综》36卷。所辑成《词综》是中国词学方面的重要选本。康熙四十八年，卒，年八十一。
张问陶,,张船山，青莲再世，少陵复出,字仲冶，号船山，蜀山老猿,,中国,,汉族,1764年6月26日,1814年4月23日,翰林院检讨，莱州知府，诗书画家,,清山东省馆陶县,《船山诗草》,,张问陶 ，字仲冶，一字柳门，号船山、蜀山老猿，清四川遂宁人。清代杰出诗人、诗论家，著名书画家。因故乡四川遂宁城郊有一座孤绝秀美的小山，形如船，名船山，便自号船山，亦称“老船”。因善画猿，亦自号“蜀山老猿”。乾隆五十五年进士，曾任翰林院检讨、江南道监察御史、吏部郎中。后出任山东莱州知府，后辞官寓居苏州虎邱山塘。晚年遨游大江南北，嘉庆十九年三月初四日，病卒于苏州寓所。撰有《船山诗草》，存诗3500余首。其诗天才横溢，价重鸡林，与袁枚、赵翼合称清代“性灵派三大家”，被誉为“青莲再世”、“少陵复出”、清代“蜀中诗人之冠”。其生平事迹见《清史稿》卷四八五《文苑》、《清史列传》卷七二《文苑传三》、《张问陶年谱》、《张船山书画年谱》等文献。遂宁市船山区即以区内文化名山船山及乡贤船山先生张问陶命名。
屈原,,屈平，屈子，屈正则,姓“芈”，字原，一字灵均,战国末期,,,华夏族,约公元前340年,公元前278年,,,丹阳秭归,《离骚》，《九歌》，《九章》，《天问》,学生：宋玉,屈原，中国战国时期楚国诗人、政治家。出生于楚国丹阳秭归。屈原，名平，字原，但实际上他姓“芈”，并不姓“屈”；又自云名正则，字灵均。楚武王熊通之子屈瑕的后代。少年时受过良好的教育，博闻强识，志向远大。早年受楚怀王信任，任左徒、三闾大夫，兼管内政外交大事。 他提倡“美政”，主张对内举贤任能，修明法度，对外力主联齐抗秦。因遭贵族排挤诽谤，被先后流放至汉北和沅湘流域。楚国郢都被秦军攻破后，屈原自沉于汨罗江，以身殉国。屈原是中国历史上第一位伟大的爱国诗人，中国浪漫主义文学的奠基人，“楚辞”的创立者和代表作家，开辟了“香草美人”的传统，被誉为“辞赋之祖”“中华诗祖”。屈原作品的出现，标志着中国诗歌进入了一个由集体歌唱到个人独创的新时代。其主要作品有《离骚》《九歌》《九章》《天问》等。以屈原作品为主体的《楚辞》是中国浪漫主义文学的源头之一，与《诗经》并称“风骚”，对后世诗歌产生了深远影响。1953年，在屈原逝世2230周年之际，世界和平理事会通过决议，确定屈原为当年纪念的世界四大文化名人之一。
宋玉,,子渊,,战国末期,,,华夏族,约前298年,约前222年,,,宋国都商丘,《九辩》，《风赋》，《高唐赋》，《神女赋》，《登徒子好色赋》,"领导：熊横
老师：屈原",宋玉，字子渊，战国时期宋国公子，因父子矛盾而出走楚国，战国末期辞赋家，平生酷爱辞赋，既懂音乐亦善于写文章，曾事楚顷襄王， 是继屈原之后又一伟大的辞赋家，与同时代的唐勒、景差齐名。所作辞赋甚多，流传作品有《九辩》《风赋》《高唐赋》《登徒子好色赋》《神女赋》。 成语“下里巴人”“阳春白雪”“曲高和寡”“宋玉东墙”的典故皆他而来。
辛弃疾,,稼轩居士，辛忠敏,原字坦夫，后改字幼安，号稼轩,南宋,,,汉族,1140年5月28日,1207年10月3日,,枢密都承旨,山东东路济南府历城县,《水龙吟·登建康赏心亭》，《永遇乐·京口北固亭怀古》，《美芹十论》,妻子：范如玉,辛弃疾，原字坦夫，后改字幼安，号稼轩，山东东路济南府历城县人。南宋豪放派词人、将领，有“词中之龙”之称。与苏轼合称“苏辛”，与李清照并称“济南二安”。辛弃疾生于金国，少年抗金归宋，曾任江西安抚使、福建安抚使等职。著有《美芹十论》、《九议》，条陈战守之策。由于与当政的主和派政见不合，后被弹劾落职，退隐山居。开禧北伐前后，相继被起用为绍兴知府、镇江知府、枢密都承旨等职。开禧三年，辛弃疾病逝，年六十八。后赠少师，谥号“忠敏”。辛弃疾一生以恢复为志，以功业自许，却命运多舛、壮志难酬。但他始终没有动摇恢复中原的信念，而是把满腔激情和对国家兴亡、民族命运的关切、忧虑，全部寄寓于词作之中。其词艺术风格多样，以豪放为主，风格沉雄豪迈又不乏细腻柔媚之处。其词题材广阔又善化用典故入词，抒写力图恢复国家统一的爱国热情，倾诉壮志难酬的悲愤，对当时执政者的屈辱求和颇多谴责；也有不少吟咏祖国河山的作品。现存词六百多首，有词集《稼轩长短句》等传世。
李清照,,,号易安居士,宋朝,,,汉族,公元1084年3月13日,约公元1155年,诗人，词人,,齐州济南,《声声慢·寻寻觅觅》，《一剪梅·红藕香残玉簟秋》，《夏日绝句》,"丈夫：赵明诚
父亲：李格非",李清照，号易安居士，汉族，齐州济南人。宋代女词人，婉约词派代表，有“千古第一才女”之称。李清照出生于书香门第，早期生活优裕，其父李格非藏书甚富，她小时候就在良好的家庭环境中打下文学基础。出嫁后与夫赵明诚共同致力于书画金石的搜集整理。金兵入据中原时，流寓南方，境遇孤苦。所作词，前期多写其悠闲生活，后期多悲叹身世，情调感伤。形式上善用白描手法，自辟途径，语言清丽。论词强调协律，崇尚典雅，提出词“别是一家”之说，反对以作诗文之法作词。能诗，留存不多，部分篇章感时咏史，情辞慷慨，与其词风不同。有《易安居士文集》《易安词》，已散佚。后人有《漱玉词》辑本。今有《李清照集校注》。
晏几道,,,字叔原，号小山,北宋,,,汉族,1038年5月29日,1110年,,,抚州临川,《小山词》,父亲：晏殊,晏几道，北宋著名词人。字叔原，号小山，抚州临川文港沙河人。晏殊第七子。历任颍昌府许田镇监、乾宁军通判、开封府判官等。性孤傲，中年家境中落。与其父晏殊合称“二晏”。词风似父而造诣过之。工于言情，其小令语言清丽，感情深挚，尤负盛名。表达情感直率。多写爱情生活，是婉约派的重要作家。有《小山词》留世。
晏殊,,晏元献,同叔,北宋,,,汉族,公元991年,公元1055年2月27日,,,抚州临川,《浣溪沙·一曲新词酒一杯》,儿子：晏几道,晏殊，字同叔，抚州临川人。北宋著名文学家、政治家。生于宋太宗淳化二年，十四岁以神童入试，赐同进士出身，命为秘书省正字，官至右谏议大夫、集贤殿学士、同平章事兼枢密使、礼部刑部尚书、观文殿大学士知永兴军、兵部尚书，宋仁宗至和二年病逝于京中，封临淄公，谥号元献，世称晏元献。晏殊以词著于文坛，尤擅小令，风格含蓄婉丽，与其子晏几道，被称为“大晏”和“小晏”，又与欧阳修并称“晏欧”；亦工诗善文，原有集，已散佚。存世有《珠玉词》、《晏元献遗文》、《类要》残本。
柳永,,柳三变，柳七，柳屯田,景庄，耆卿,北宋,,,汉族,约984年,约1053年,,,费县,《乐章集》，《雨霖铃·寒蝉凄切》,"儿子：柳涚
父亲：柳宜
哥哥：柳三复
侄子：柳淇",柳永，原名三变，字景庄，后改名柳永，字耆卿，因排行第七，又称柳七，福建崇安人，北宋著名词人，婉约派代表人物。柳永出身官宦世家，少时学习诗词，有功名用世之志。咸平五年，柳永离开家乡，流寓杭州、苏州，沉醉于听歌买笑的浪漫生活之中。大中祥符元年，柳永进京参加科举，屡试不中，遂一心填词。景祐元年，柳永暮年及第，历任睦州团练推官、余杭县令、晓峰盐碱、泗州判官等职，以屯田员外郎致仕，故世称柳屯田。柳永是第一位对宋词进行全面革新的词人， 也是两宋词坛上创用词调最多的词人。柳永大力创作慢词，将敷陈其事的赋法移植于词，同时充分运用俚词俗语，以适俗的意象、淋漓尽致的铺叙、平淡无华的白描等独特的艺术个性，对宋词的发展产生了深远影响。
姜夔,,,字尧章，号白石道人,南宋,,,汉人,1154年,1221年,文学家，音乐家,,饶州鄱阳,《白石道人诗集》，《白石道人歌曲》，《续书谱》，《绛帖平》,,姜夔 ，字尧章，号白石道人，汉族，饶州鄱阳人。南宋文学家、音乐家。他少年孤贫，屡试不第，终生未仕，一生转徙江湖，靠卖字和朋友接济为生。他多才多艺，精通音律，能自度曲，其词格律严密。其作品素以空灵含蓄著称，姜夔对诗词、散文、书法、音乐，无不精善，是继苏轼之后又一难得的艺术全才。姜夔词题材广泛，有感时、抒怀、咏物、恋情、写景、记游、节序、交游、酬赠等。他在词中抒发了自己虽然流落江湖，但不忘君国的感时伤世的思想，描写了自己漂泊的羁旅生活，抒发自己不得用世及情场失意的苦闷心情，以及超凡脱俗、飘然不群，有如孤云野鹤般的个性。姜夔晚居西湖，卒葬西马塍。有《白石道人诗集》《白石道人歌曲》《续书谱》《绛帖平》等书传世。
秦观,,淮海居士，山抹微云君,字少游，号太虚，别号邗沟居士,北宋,,,汉人,皇祐元年十二月）,元符三年八月十二日9月17日）,,太学博士，国史馆编修,淮南东路高邮,《淮海集》，《淮海居士长短句》,,秦观，江苏省高邮市人，字少游，号太虚，别号邗沟居士，学者称其淮海居士。苏轼曾戏呼其为“山抹微云君”，北宋婉约词人。官至太学博士、国史馆编修。一生坎坷，所写诗词，高古沉重，寄托身世，感人至深。他长于议论，文丽思深，兼有诗、词、文赋和书法多方面的艺术才能，尤以婉约之词驰名于世。著有《淮海集》40卷、《淮海词》3卷、《劝善录》、《逆旅集》等。为“苏门四学士”、“苏门六君子”之一。秦观是北宋文学史上的一位重要作家，被尊为婉约派一代词宗。但在秦观现存的所有作品中，词只有三卷100多首，而诗有十四卷430多首，文则达三十卷共250多篇，诗文相加，其篇幅远远超过词若干倍。
李煜,,南唐后主，李后主，词帝,字重光，号钟隐，莲峰居士,五代十国,,,汉族,937年8月15日,978年8月13日,,,金陵,《南唐二主词》,"妻子：小周后，周娥皇
父亲：李璟",李煜，南唐元宗李璟第六子，初名从嘉，字重光，号钟隐、莲峰居士，汉族，生于金陵，祖籍彭城，南唐最后一位国君。北宋建隆二年，李煜继位，尊宋为正统，岁贡以保平安。开宝四年十月，宋太祖灭南汉，李煜去除唐号，改称“江南国主”。次年，贬损仪制，撤去金陵台殿鸱吻以示尊奉宋廷。开宝八年，李煜兵败降宋，被俘至汴京，授右千牛卫上将军，封违命侯。太平兴国三年七月七日，李煜死于汴京，追赠太师，追封吴王。世称南唐后主、李后主。李煜精书法、工绘画、通音律，诗文均有一定造诣，尤以词的成就最高。李煜的词，继承了晚唐以来温庭筠、韦庄等花间派词人的传统，又受李璟、冯延巳等的影响，语言明快、形象生动、用情真挚，风格鲜明，其亡国后词作更是题材广阔，含意深沉，在晚唐五代词中别树一帜，对后世词坛影响深远。
岳飞,,岳武穆,字鹏举,南宋,,,汉族,公元1103年3月24日,公元1142年1月27日,,湖北，京西南路宣抚使兼营田大使,相州汤阴县,《满江红·写怀》，《小重山·昨夜寒蛩不住鸣》，《五岳祠盟记》,"妻子：李娃
同门：卢俊义
对手：完颜宗弼",岳飞，字鹏举，相州汤阴人。南宋时期抗金名将、军事家、战略家、民族英雄、书法家、诗人，位列南宋“中兴四将”之首。岳飞从二十岁起，曾先后四次从军。自建炎二年遇宗泽至绍兴十一年止，先后参与、指挥大小战斗数百次。金军攻打江南时，独树一帜，力主抗金，收复建康。绍兴四年，收复襄阳六郡。绍兴六年，率师北伐，顺利攻取商州、虢州等地。绍兴十年，完颜宗弼毁盟攻宋，岳飞挥师北伐，两河人民奔走相告，各地义军纷纷响应，夹击金军。岳家军先后收复郑州、洛阳等地，在郾城、颍昌大败金军，进军朱仙镇。宋高宗赵构和宰相秦桧却一意求和，以十二道“金字牌”催令班师。在宋金议和过程中，岳飞遭受秦桧、张俊等人诬陷入狱。1142年1月，以莫须有的罪名，与长子岳云、部将张宪一同遇害。宋孝宗时，平反昭雪，改葬于西湖畔栖霞岭，追谥武穆，后又追谥忠武，封鄂王。岳飞是南宋杰出的统帅，他重视人民抗金力量，缔结了“联结河朔”之谋，主张黄河以北的民间抗金义军和宋军互相配合，以收复失地；治军赏罚分明，纪律严整，又能体恤部属，以身作则，率领的“岳家军”号称“冻死不拆屋，饿死不打掳”。金军有“撼山易，撼岳家军难”的评语，以示对岳家军的由衷敬佩。岳飞的文学才华也是将帅中少有的，代表词作《满江红·写怀》，是千古传诵的爱国名篇，后人辑有文集传世。
朱熹,,朱子，文公，紫阳先生，考亭先生，沧州病叟，云谷老人,字元晦，一字仲晦，号晦庵,宋朝,,,汉族,1130年9月15日,1200年4月23日,,,南剑州尤溪,《四书章句集注》，《楚辞集注》，《晦庵词》,,朱熹，字元晦，又字仲晦，号晦庵，晚称晦翁，谥文，世称朱文公。祖籍徽州府婺源县，出生于南剑州尤溪。宋朝著名的理学家、思想家、哲学家、教育家、诗人，闽学派的代表人物，儒学集大成者，世尊称为朱子。朱熹是唯一非孔子亲传弟子而享祀孔庙，位列大成殿十二哲者中，受儒教祭祀。朱熹是“二程”的三传弟子李侗的学生，与二程合称“程朱学派”。朱熹的理学思想对元、明、清三朝影响很大，成为三朝的官方哲学，是中国教育史上继孔子后的又一人。朱熹十九岁考中进士，曾任江西南康、福建漳州知府、浙东巡抚，做官清正有为，振举书院建设。官拜焕章阁侍制兼侍讲，为宋宁宗皇帝讲学。朱熹著述甚多，有《四书章句集注》《太极图说解》《通书解说》《周易读本》《楚辞集注》，后人辑有《朱子大全》《朱子集语象》等。其中《四书章句集注》成为钦定的教科书和科举考试的标准。
